{
  "work_id": "backend-migration-pr49-review",
  "sources": [
    "https://github.com/Vinidel/feeling/pull/49",
    "Git commit 1f03ca50a0f7a6ab8c36959dd39c25c8ff2754b5",
    "Git commit 6ef224c49533230716793253745cd11fa44847fe",
    "specs/backend-migration/brief.json",
    "specs/backend-migration/design.json",
    "specs/backend-migration/plan.json",
    "specs/backend-migration/implementation.json",
    "specs/backend-migration/review.json",
    "specs/backend-migration/release.json",
    "specs/backend-migration/stage-19-decommission.md",
    "api/deno.json",
    "api/Dockerfile",
    "api/src/database.ts",
    "api/tests/compatibility_test.ts",
    "https://raw.githubusercontent.com/porsager/postgres/v3.4.9/src/connection.js"
  ],
  "verdict": "needs_input",
  "findings": [
    {
      "id": "PR49-001",
      "severity": "info",
      "status": "resolved",
      "summary": "Both Cursor fixes fit the migrated Azure/Deno and Supabase architecture; no code regression identified.",
      "evidence": "Loopback port 55322 matches supabase/config.toml and is added only to the local task; Docker CMD remains restricted. postgres 3.4.9 secure() maps string require to rejectUnauthorized=false; the new object enables verification while retaining prepare:false and existing pooling/RLS. Migration and historical rollback tooling receive the same hardening; this does not reactivate decommissioned MongoDB.",
      "owner": "Vinicius Delascio"
    },
    {
      "id": "PR49-002",
      "severity": "medium",
      "status": "open",
      "summary": "TLS connection evidence is still needed before deploying the changed runtime.",
      "evidence": "compatibility_test.ts:41-56 asserts a lazy client and SSL option values without a handshake. All 30 API tests pass in the existing Deno 2.9.4 stage-13 image with current source mounted read-only and network none. This does not prove that the hosted certificate is trusted or that invalid certificates are rejected in a real connection. Run a non-mutating SELECT 1 using the pinned runtime and approved pooler, plus a controlled invalid-certificate test. No production credentials or hosted database were accessed in this review.",
      "owner": "Vinicius Delascio"
    },
    {
      "id": "PR49-003",
      "severity": "info",
      "status": "resolved",
      "summary": "The CORS comment describes a configuration dependency, not an established migrated-production defect.",
      "evidence": "Stage 19 lines 64-66 records both the Azure public origin and https://www.delasc.io in deployed CORS_ORIGINS, and authenticated browser success. Docker ENV is not the complete Azure runtime configuration. Exact-origin rejection matches the approved boundary; arbitrary revision hostnames need not be accepted. Live Azure configuration was not rechecked.",
      "owner": "Vinicius Delascio"
    },
    {
      "id": "PR49-004",
      "severity": "info",
      "status": "open",
      "summary": "Existing lifecycle validation limitation remains; this focused review does not supersede the approved historical migration review.",
      "evidence": "All four upstream artifacts pass structure; brief/design/plan pass readiness. implementation readiness fails at stages[2].test_evidence[7].result, the historical direct-IPv6 probe already explained by REV-FINAL-004. No lifecycle stage advancement or deployment is authorized by this report.",
      "owner": "Vinicius Delascio"
    }
  ],
  "acceptance_criteria_evidence": [
    {
      "ac_id": "AC-9",
      "status": "pass",
      "evidence": "Current API suite: 30 passed, zero failed, including CORS and shared feelings/weekly contracts. Command: docker run --rm --network none --mount type=bind,src=/Users/vinny/workspace/personal/feeling,dst=/review,readonly -w /review/api feeling-api:stage-13-evidence task test. First attempt mounted only api and failed to locate shared contract fixtures; corrected whole-repository mount passed."
    },
    {
      "ac_id": "AC-11",
      "status": "not_verified",
      "evidence": "Static review confirms unchanged transaction-local identity, least-privilege connection selection and RLS plumbing. Stronger TLS configuration is correct by driver source; real hosted handshake not reverified in this focused review."
    }
  ],
  "approval": {
    "status": "pending",
    "by": "",
    "at": "",
    "reason": "Focused assessment of Cursor comments/fixes only. Historical migration approval is preserved; no new approval, waiver, deployment, or live-state certification is inferred."
  }
}
